"Schnittstelle zur Menschen: Gute Hörbarkeit akustischer Warnsignale";"ja";"Verschiedene elektronische Produkte bieten die Möglichkeit akkustischer oder taktiler Warnmechanismen für Fehlfunktionen oder als Feedbacksystem.";"6 Ungeeignete, unzulängliche oder zu komplizierte Schnittstelle mit dem Anwender"
"Einfluss auf die Lebensdauer des Produkts: Alterung";"ja";"Alterung und die einsatzbedingte Abnutzung der verwendeten Materialien (Kunststoffe etc.) kann die Lebensdauer der Orthesen verringern.";"7 Gefährdungen infolge von Funktionsfehlern, falscher Wartung und Alterung"
"Begrenzung der Nutzungsdauer: Kennzeichnung oder die Indikatoren";"ja";"Die Nutzungsdauer kann vom Hersteller festgelegt und in der Gebrauchsanweisung dargestellt werden (z.B. Interimsorthesen, Testorthesen, Passteile).";"7 Gefährdungen infolge von Funktionsfehlern, falscher Wartung und Alterung"
"Einfluss auf die Lebensdauer des Produkts: Erschöpfung von Batterien/Akkus";"ja";"Eine nachlassende Nutzungsdauer pro Ladezyklus kann Einfluss auf die Funktion haben.";"7 Gefährdungen infolge von Funktionsfehlern, falscher Wartung und Alterung"
"Software: Installation, Verifizierung, Änderung oder Austausch der Software";"ja";"Elektronische Komponenten können eine Software beinhalten, bei der Softwareupdates herstellerseitig empfohlen sein können.";"7 Gefährdungen infolge von Funktionsfehlern, falscher Wartung und Alterung"
"Software: Anwender und/oder Bediener vorgesehen?";"ja";"Elektronischen Bauteilen liegen häufig Programme bei, die eine Einstellung und Optimierung von Funktionsparametern zulassen.";"7 Gefährdungen infolge von Funktionsfehlern, falscher Wartung und Alterung"
"Ergonomische und kumulative Auswirkungen einer Langzeitanwendung";"ja";"Genannte Auswirkungen können sowohl im positiven als auch negativen Sinne auftreten. Hintergründe können sowohl Fehlfunktionen der Orthese als auch körperliche, strukturelle Veränderungen der Nutzer sein.";"7 Gefährdungen infolge von Funktionsfehlern, falscher Wartung und Alterung"
"Wartung und Kalibrierung: Besondere Werkzeuge";"ja";"Herstellerspezifische Werkzeuge können vonnöten sein. Hierzu zählen auch Softwarediagnose-Programme.";"7 Gefährdungen infolge von Funktionsfehlern, falscher Wartung und Alterung"
"Wartung und Kalibrierung: Wartung und/oder Kalibrierung durch den Bediener, den Anwender oder einen Fachmann.";"ja";"Kontrolltermine der Passform sowie Grundeinstellungen an Funktionsteilen der Orthese dienen der ordnungsgemäßen Versorgung und sollten vom Hersteller der Orthese spezifiziert / definiert werden.";"7 Gefährdungen infolge von Funktionsfehlern, falscher Wartung und Alterung"
"Sterilität, Sterilisation, mikrobiologische Beherrschbarkeit: Wiederverwendung";"ja";"Orthesen werden vom Anwender wiederverwendet und sollten hierfür gemäß Herstellervorgaben gereinigt werden.";"7 Gefährdungen infolge von Funktionsfehlern, falscher Wartung und Alterung"
"Herstellungsprozesse: Neue Herstellungsprozesse müssen als mögliche Ursache neuer Gefährdungen betrachtet werden";"ja";"Änderungen etablierter Fertigungsverfahren aber auch die Weiterentwicklung der Herstellungsmöglichkeiten lassen auf Grund des Materialeinsatzes unterschiedliche Gefährdungen entstehen.";"8 Gefährdungen infolge von Herstellungsfehlern"
"Herstellungsprozesse: etablierte Verfahren";"ja";"Auch hier können durch Veränderung des Materialeinsatzes, der Umgebungsbedingungen oder auch nur chargenbedingt neue Gefährdungen entstehen";"8 Gefährdungen infolge von Herstellungsfehlern"
"Herstellungsprozesse: Neue Technologie";"ja";"Die mechanischen verbleibenden Restrisiken können unterschiedlich ausfallen";"8 Gefährdungen infolge von Herstellungsfehlern"
"Herstellungsprozesse: neues Verfahren";"ja";"Die mechanischen verbleibenden Restrisiken können unterschiedlich ausfallen";"8 Gefährdungen infolge von Herstellungsfehlern"
"Herstellung";"ja";"Orthesen werden für jeden Patienten individuell angefertigt nachdem diese ggf. von einem Arzt oder einer qualifizierten Person begutachtet wurden und nachdem entsprechende Formbestimmungen (Abdruck, Scan, Maßnahme, Modellherstellung) vorgenommen wurden.";"8 Gefährdungen infolge von Herstellungsfehlern"
